{"artifact_role":"runtime_artifact","checks":[{"check_id":"IF1","kind":"goals_supported_by_source","status":"pass"},{"check_id":"IF2","kind":"outcomes_supported_by_source","status":"pass"},{"check_id":"IF3","kind":"constraints_supported_by_source","status":"pass"},{"check_id":"IF4","kind":"no_material_omissions","status":"pass"},{"check_id":"IF5","kind":"no_unrequested_execution","status":"pass"},{"check_id":"IF6","kind":"ambiguity_unknown_classification","status":"pass"}],"decisions":[],"errors":[],"fidelity_id":"intent-fidelity-07-research-microplastics-health-retry-02-g1","intent_ir_ref":{"generation":1,"intent_ir_id":"intent-ir-07-research-microplastics-health-retry-02","sha256":"89d8f48b04bcfde19af0fba01c7345cb80373f5496e6fcdae875c8bb80e403c5"},"raw_intent_ref":{"raw_intent_id":"07-research-microplastics-health-retry-02","raw_text_sha256":"f0d76af9723fcf0e8b2cf29562fd401fd5aba16d33582ae2cae2a0c300b5a413"},"review_method":"independent_model_call","reviewer":{"model":"gpt-5.6-luna","provider":"codex"},"schema_version":"solar.intent_fidelity.v1","status":"pass","warnings":[]}
